{
  "schema_version": "3.3",
  "ticker": "META",
  "company_name": "Meta Platforms, Inc.",
  "as_of_date": "2026-09-18",
  "reporting_currency": "USD",
  "documents": [
    {
      "document_id": "DOC-001",
      "source_document": "https://www.sec.gov/Archives/edgar/data/1326801/000162828026003942/meta-20251231.htm",
      "document_type": "10-K",
      "filing_date": "2026-01-29",
      "period_end": "2025-12-31",
      "is_amendment": false
    },
    {
      "document_id": "DOC-002",
      "source_document": "https://www.sec.gov/Archives/edgar/data/1326801/000162828026050705/meta-20260630.htm",
      "document_type": "10-Q",
      "filing_date": "2026-07-30",
      "period_end": "2026-06-30",
      "is_amendment": false
    },
    {
      "document_id": "DOC-003",
      "source_document": "https://www.sec.gov/Archives/edgar/data/1326801/000162828026028526/meta-20260331.htm",
      "document_type": "10-Q",
      "filing_date": "2026-04-30",
      "period_end": "2026-03-31",
      "is_amendment": false
    },
    {
      "document_id": "DOC-004",
      "source_document": "https://www.sec.gov/Archives/edgar/data/1326801/000162828025047240/meta-20250930.htm",
      "document_type": "10-Q",
      "filing_date": "2025-10-30",
      "period_end": "2025-09-30",
      "is_amendment": false
    },
    {
      "document_id": "DOC-005",
      "source_document": "https://www.sec.gov/Archives/edgar/data/1326801/000162828025036791/meta-20250630.htm",
      "document_type": "10-Q",
      "filing_date": "2025-07-31",
      "period_end": "2025-06-30",
      "is_amendment": false
    },
    {
      "document_id": "DOC-006",
      "source_document": "https://www.sec.gov/Archives/edgar/data/1326801/000132680125000054/meta-20250331.htm",
      "document_type": "10-Q",
      "filing_date": "2025-05-01",
      "period_end": "2025-03-31",
      "is_amendment": false
    },
    {
      "document_id": "DOC-007",
      "source_document": "https://www.sec.gov/Archives/edgar/data/1326801/000132680124000081/meta-20240930.htm",
      "document_type": "10-Q",
      "filing_date": "2024-10-31",
      "period_end": "2024-09-30",
      "is_amendment": false
    }
  ],
  "facts": [
    {
      "fact_id": "FACT-0001",
      "metric": "revenue",
      "metric_detail": null,
      "reported_label": null,
      "statement": "income",
      "gaap_status": "gaap",
      "value_reported": 60801,
      "unit_kind": "currency",
      "currency": "USD",
      "scale_multiplier": 1000000,
      "period_start": null,
      "period_end": "2026-06-30",
      "period_kind": "quarter",
      "fiscal_year": 2026,
      "fiscal_quarter": 2,
      "segment": null,
      "filing_date": null,
      "source_document": "https://www.sec.gov/Archives/edgar/data/1326801/000162828026050705/meta-20260630.htm",
      "source_page": null,
      "source_section": "Condensed Consolidated Statements of Income",
      "source_locator": null,
      "source_quote": null,
      "is_amended": false,
      "is_restated": false,
      "confidence": 0.99,
      "requires_review": false,
      "review_reason": null
    },
    {
      "fact_id": "FACT-0002",
      "metric": "operating_income",
      "metric_detail": null,
      "reported_label": null,
      "statement": "income",
      "gaap_status": "gaap",
      "value_reported": 18775,
      "unit_kind": "currency",
      "currency": "USD",
      "scale_multiplier": 1000000,
      "period_start": null,
      "period_end": "2026-06-30",
      "period_kind": "quarter",
      "fiscal_year": 2026,
      "fiscal_quarter": 2,
      "segment": null,
      "filing_date": null,
      "source_document": "https://www.sec.gov/Archives/edgar/data/1326801/000162828026050705/meta-20260630.htm",
      "source_page": null,
      "source_section": "Condensed Consolidated Statements of Income",
      "source_locator": null,
      "source_quote": null,
      "is_amended": false,
      "is_restated": false,
      "confidence": 0.99,
      "requires_review": false,
      "review_reason": null
    },
    {
      "fact_id": "FACT-0003",
      "metric": "net_income",
      "metric_detail": null,
      "reported_label": null,
      "statement": "income",
      "gaap_status": "gaap",
      "value_reported": 15848,
      "unit_kind": "currency",
      "currency": "USD",
      "scale_multiplier": 1000000,
      "period_start": null,
      "period_end": "2026-06-30",
      "period_kind": "quarter",
      "fiscal_year": 2026,
      "fiscal_quarter": 2,
      "segment": null,
      "filing_date": null,
      "source_document": "https://www.sec.gov/Archives/edgar/data/1326801/000162828026050705/meta-20260630.htm",
      "source_page": null,
      "source_section": "Condensed Consolidated Statements of Income",
      "source_locator": null,
      "source_quote": null,
      "is_amended": false,
      "is_restated": false,
      "confidence": 0.99,
      "requires_review": false,
      "review_reason": null
    },
    {
      "fact_id": "FACT-0004",
      "metric": "r_and_d",
      "metric_detail": null,
      "reported_label": null,
      "statement": "income",
      "gaap_status": "gaap",
      "value_reported": 21656,
      "unit_kind": "currency",
      "currency": "USD",
      "scale_multiplier": 1000000,
      "period_start": null,
      "period_end": "2026-06-30",
      "period_kind": "quarter",
      "fiscal_year": 2026,
      "fiscal_quarter": 2,
      "segment": null,
      "filing_date": null,
      "source_document": "https://www.sec.gov/Archives/edgar/data/1326801/000162828026050705/meta-20260630.htm",
      "source_page": null,
      "source_section": "Condensed Consolidated Statements of Income",
      "source_locator": null,
      "source_quote": null,
      "is_amended": false,
      "is_restated": false,
      "confidence": 0.99,
      "requires_review": false,
      "review_reason": null
    },
    {
      "fact_id": "FACT-0005",
      "metric": "basic_weighted_average_shares",
      "metric_detail": null,
      "reported_label": null,
      "statement": "shares",
      "gaap_status": "gaap",
      "value_reported": 2543,
      "unit_kind": "shares",
      "currency": null,
      "scale_multiplier": 1000000,
      "period_start": null,
      "period_end": "2026-06-30",
      "period_kind": "quarter",
      "fiscal_year": 2026,
      "fiscal_quarter": 2,
      "segment": null,
      "filing_date": null,
      "source_document": "https://www.sec.gov/Archives/edgar/data/1326801/000162828026050705/meta-20260630.htm",
      "source_page": null,
      "source_section": "Condensed Consolidated Statements of Income",
      "source_locator": null,
      "source_quote": null,
      "is_amended": false,
      "is_restated": false,
      "confidence": 0.99,
      "requires_review": false,
      "review_reason": null
    },
    {
      "fact_id": "FACT-0006",
      "metric": "diluted_weighted_average_shares",
      "metric_detail": null,
      "reported_label": null,
      "statement": "shares",
      "gaap_status": "gaap",
      "value_reported": 2566,
      "unit_kind": "shares",
      "currency": null,
      "scale_multiplier": 1000000,
      "period_start": null,
      "period_end": "2026-06-30",
      "period_kind": "quarter",
      "fiscal_year": 2026,
      "fiscal_quarter": 2,
      "segment": null,
      "filing_date": null,
      "source_document": "https://www.sec.gov/Archives/edgar/data/1326801/000162828026050705/meta-20260630.htm",
      "source_page": null,
      "source_section": "Condensed Consolidated Statements of Income",
      "source_locator": null,
      "source_quote": null,
      "is_amended": false,
      "is_restated": false,
      "confidence": 0.99,
      "requires_review": false,
      "review_reason": null
    },
    {
      "fact_id": "FACT-0007",
      "metric": "revenue",
      "metric_detail": null,
      "reported_label": null,
      "statement": "income",
      "gaap_status": "gaap",
      "value_reported": 117111,
      "unit_kind": "currency",
      "currency": "USD",
      "scale_multiplier": 1000000,
      "period_start": null,
      "period_end": "2026-06-30",
      "period_kind": "ytd",
      "fiscal_year": 2026,
      "fiscal_quarter": 2,
      "segment": null,
      "filing_date": null,
      "source_document": "https://www.sec.gov/Archives/edgar/data/1326801/000162828026050705/meta-20260630.htm",
      "source_page": null,
      "source_section": "Condensed Consolidated Statements of Income",
      "source_locator": null,
      "source_quote": null,
      "is_amended": false,
      "is_restated": false,
      "confidence": 0.99,
      "requires_review": false,
      "review_reason": null
    },
    {
      "fact_id": "FACT-0008",
      "metric": "operating_income",
      "metric_detail": null,
      "reported_label": null,
      "statement": "income",
      "gaap_status": "gaap",
      "value_reported": 41647,
      "unit_kind": "currency",
      "currency": "USD",
      "scale_multiplier": 1000000,
      "period_start": null,
      "period_end": "2026-06-30",
      "period_kind": "ytd",
      "fiscal_year": 2026,
      "fiscal_quarter": 2,
      "segment": null,
      "filing_date": null,
      "source_document": "https://www.sec.gov/Archives/edgar/data/1326801/000162828026050705/meta-20260630.htm",
      "source_page": null,
      "source_section": "Condensed Consolidated Statements of Income",
      "source_locator": null,
      "source_quote": null,
      "is_amended": false,
      "is_restated": false,
      "confidence": 0.99,
      "requires_review": false,
      "review_reason": null
    },
    {
      "fact_id": "FACT-0009",
      "metric": "net_income",
      "metric_detail": null,
      "reported_label": null,
      "statement": "income",
      "gaap_status": "gaap",
      "value_reported": 42621,
      "unit_kind": "currency",
      "currency": "USD",
      "scale_multiplier": 1000000,
      "period_start": null,
      "period_end": "2026-06-30",
      "period_kind": "ytd",
      "fiscal_year": 2026,